{
  "$schema": "http://json-schema.org/draft-07/schema#",
  "title": "AI7 Provider Processing Policy v1",
  "description": "Validates the exact fail-closed Provider Processing Policy v1 baseline.",
  "type": "object",
  "additionalProperties": false,
  "required": [
    "schemaDialect",
    "schemaPath",
    "documentType",
    "policyId",
    "policyType",
    "version",
    "lifecycleStatus",
    "predecessorVersion",
    "canonicalPath",
    "humanProjectionPath",
    "authorityBasis",
    "decision",
    "outboundDataCategories",
    "credentialBoundary",
    "authoritySeparations"
  ],
  "properties": {
    "schemaDialect": {
      "enum": [
        "http://json-schema.org/draft-07/schema#"
      ]
    },
    "schemaPath": {
      "enum": [
        "docs/policies/provider-processing-policy.v1.schema.json"
      ]
    },
    "documentType": {
      "enum": [
        "ai7-policy-document"
      ]
    },
    "policyId": {
      "enum": [
        "provider-processing-policy"
      ]
    },
    "policyType": {
      "enum": [
        "provider-processing"
      ]
    },
    "version": {
      "enum": [
        "v1"
      ]
    },
    "lifecycleStatus": {
      "enum": [
        "active"
      ]
    },
    "predecessorVersion": {
      "type": "null"
    },
    "canonicalPath": {
      "enum": [
        "docs/policies/provider-processing-policy.v1.json"
      ]
    },
    "humanProjectionPath": {
      "enum": [
        "docs/policies/provider-processing-policy.md"
      ]
    },
    "authorityBasis": {
      "type": "array",
      "minItems": 6,
      "maxItems": 6,
      "uniqueItems": true,
      "items": {
        "enum": [
          "docs/domain/execution/CONTEXT.md",
          "docs/adr/0007-separate-decisions-authority-and-effect-proof.md",
          "docs/adr/0016-proprietary-license-and-local-only-sample-manuscripts.md",
          "docs/adr/0018-tiered-activation-for-agent-authored-revisions.md",
          "docs/architecture-v2/HARNESS-INTEGRATION.md",
          "kick-in/22-task-skill-capability-trust-provider-boundary.md"
        ]
      }
    },
    "decision": {
      "type": "object",
      "additionalProperties": false,
      "required": [
        "default",
        "providerAllowRules",
        "authorizedLiveTransmissionCount"
      ],
      "properties": {
        "default": {
          "enum": [
            "deny"
          ]
        },
        "providerAllowRules": {
          "type": "array",
          "maxItems": 0
        },
        "authorizedLiveTransmissionCount": {
          "type": "integer",
          "minimum": 0,
          "maximum": 0
        }
      }
    },
    "outboundDataCategories": {
      "type": "object",
      "additionalProperties": false,
      "required": [
        "public-or-synthetic",
        "unpublished-metadata",
        "unpublished-excerpts",
        "unpublished-full-content"
      ],
      "properties": {
        "public-or-synthetic": {
          "$ref": "#/definitions/publicOrSynthetic"
        },
        "unpublished-metadata": {
          "$ref": "#/definitions/unpublishedMetadata"
        },
        "unpublished-excerpts": {
          "$ref": "#/definitions/unpublishedExcerpts"
        },
        "unpublished-full-content": {
          "$ref": "#/definitions/unpublishedFullContent"
        }
      }
    },
    "credentialBoundary": {
      "type": "object",
      "additionalProperties": false,
      "required": [
        "isOutboundDataCategory",
        "permittedInModelVisibleMaterial",
        "permittedInGeneralOutboundMaterial",
        "opaqueReferenceOnlyOutsideFinalConsumer",
        "finalProtocolUseRequiresSeparateAuthorization",
        "thisPolicyAuthorizesCredentialUse"
      ],
      "properties": {
        "isOutboundDataCategory": {
          "enum": [
            false
          ]
        },
        "permittedInModelVisibleMaterial": {
          "enum": [
            false
          ]
        },
        "permittedInGeneralOutboundMaterial": {
          "enum": [
            false
          ]
        },
        "opaqueReferenceOnlyOutsideFinalConsumer": {
          "enum": [
            true
          ]
        },
        "finalProtocolUseRequiresSeparateAuthorization": {
          "enum": [
            true
          ]
        },
        "thisPolicyAuthorizesCredentialUse": {
          "enum": [
            false
          ]
        }
      }
    },
    "authoritySeparations": {
      "type": "object",
      "additionalProperties": false,
      "required": [
        "runSourceScopeAloneAuthorizesTransmission",
        "runAuthorizationAloneOverridesThisPolicy",
        "configuredProviderAloneAuthorizesTransmission",
        "configuredCredentialAloneAuthorizesTransmission",
        "externalExportPolicyAuthorizesProviderTransmission",
        "publicReleasePermissionAuthorizesProviderTransmission"
      ],
      "properties": {
        "runSourceScopeAloneAuthorizesTransmission": {
          "enum": [
            false
          ]
        },
        "runAuthorizationAloneOverridesThisPolicy": {
          "enum": [
            false
          ]
        },
        "configuredProviderAloneAuthorizesTransmission": {
          "enum": [
            false
          ]
        },
        "configuredCredentialAloneAuthorizesTransmission": {
          "enum": [
            false
          ]
        },
        "externalExportPolicyAuthorizesProviderTransmission": {
          "enum": [
            false
          ]
        },
        "publicReleasePermissionAuthorizesProviderTransmission": {
          "enum": [
            false
          ]
        }
      }
    }
  },
  "definitions": {
    "publicOrSynthetic": {
      "type": "object",
      "additionalProperties": false,
      "required": [
        "labelZh"
      ],
      "properties": {
        "labelZh": {
          "enum": [
            "公开或合成内容"
          ]
        }
      }
    },
    "unpublishedMetadata": {
      "type": "object",
      "additionalProperties": false,
      "required": [
        "labelZh"
      ],
      "properties": {
        "labelZh": {
          "enum": [
            "未公开材料元数据"
          ]
        }
      }
    },
    "unpublishedExcerpts": {
      "type": "object",
      "additionalProperties": false,
      "required": [
        "labelZh"
      ],
      "properties": {
        "labelZh": {
          "enum": [
            "未公开材料选段"
          ]
        }
      }
    },
    "unpublishedFullContent": {
      "type": "object",
      "additionalProperties": false,
      "required": [
        "labelZh"
      ],
      "properties": {
        "labelZh": {
          "enum": [
            "未公开材料全文"
          ]
        }
      }
    }
  }
}
